<!ELEMENT agenda (contacto+)>
<!ELEMENT contacto (nombre,nacimiento, telefono, email, nacionalidad)>
<!ELEMENT nombre (#PCDATA)>
<!ELEMENT telefono (#PCDATA)>
<!ELEMENT email (#PCDATA)>
<!ELEMENT nacionalidad (#PCDATA)>
<!ELEMENT nacimiento (#PCDATA)>